PaymentMethodID,MethodName,Description
1,task,Whom off shoulder rock dream.
2,company,Theory technology there miss where even economic.
3,room,Card material other think yet will old.
4,involve,Interest perform open by fine run.
5,help,Woman over Mr woman pattern scientist.
6,trade,Order officer cup shake because.
7,movement,Go kind guy several room.
8,just,Set off law.
9,southern,Money seat there painting major partner.
10,school,Political really notice clear.
11,hit,Either near crime after more.
12,actually,Control star evening data.
13,lead,Cost act media loss town.
14,than,Participant entire since mouth two rule degree property.
15,every,Civil story soon.
16,resource,Law reason save training.
17,drive,History manager assume many.
18,beyond,Conference contain agreement save mother civil.
19,charge,Close his true.
20,reduce,Water degree method fill health scientist.
21,business,Size evening control down billion democratic land.
22,now,Site present sign truth.
23,color,Toward table owner look official personal system.
24,teach,Trip energy low glass at level left.
25,win,Future executive so radio wish.
26,computer,It agent still agency evidence serious.
27,do,They another different.
28,fast,Information hear activity system fast nice base its.
29,either,Book discover different career claim fast.
30,remain,Care single business not.
31,country,Star bad inside reach data.
32,impact,Seat poor three open president sport hair.
33,teacher,Send eye politics also Republican oil.
34,business,Simple ask figure defense level.
35,really,Option herself what top computer race change.
36,keep,Necessary director care music history avoid of want.
37,nor,Those wall benefit treatment believe quickly voice child.
38,sea,Page allow ahead production industry these reduce.
39,per,Firm interview hard soon tell contain kid.
40,less,Yet enter series way bed hundred.
41,score,Difference describe pass available head run per.
42,good,Whose available edge new.
43,join,Perhaps describe boy.
44,challenge,Event such across unit hit.
45,heavy,Single employee edge.
46,half,Stage never early show treat growth.
47,use,Easy already hold let style either development.
48,at,Tend pull president reflect officer work.
49,strong,Although include anyone do political newspaper usually.
50,contain,Field go fear number keep attention participant.
51,almost,Officer by sound machine ever.
52,movie,Fish be kind note activity possible hard.
53,player,Add budget send media civil always property.
54,election,Word late source live season.
55,see,Put avoid class recognize.
56,single,Assume edge hundred they.
57,cause,To laugh about development beyond need case.
58,crime,Check throw future other popular floor.
59,present,Window site present tough.
60,teach,Success bank minute when.
61,education,Page happen his black.
62,Mrs,Factor market east result town middle foot factor.
63,theory,Follow evening cover major not TV.
64,yeah,Cost sort collection perhaps reason growth option.
65,per,Deep a accept occur discover finally foot over.
66,ready,Third kind ability.
67,word,Eye throughout some Congress.
68,lay,Indeed someone often.
69,what,Life attorney child practice finish enough.
70,wrong,With history beyond artist.
71,resource,Different world movement audience chair happy.
72,economic,Page network authority class town much figure season.
73,or,Put national recent poor.
74,cup,Without during time participant want investment accept.
75,board,Human brother economy wind career court.
76,protect,Impact eat his agreement develop scene agency share.
77,wish,Feeling face throw item few.
78,take,Language whether example difference accept far exist not.
79,as,Campaign protect my but themselves me degree.
80,per,Bar administration pick their trouble ball.
81,detail,Certainly law cause such.
82,field,Financial marriage action year reflect fill gas.
83,example,Entire close west where young both another book.
84,market,Modern reality everyone charge with.
85,fine,Would commercial person moment clear.
86,significant,Region world art act service cost his something.
87,coach,Population wish involve page.
88,service,Beautiful real sign usually level north.
89,trip,Magazine long good before source interest garden.
90,left,Option thousand challenge mention already.
91,kid,Various quite responsibility on reduce pretty owner.
92,want,College pattern entire more civil expect find.
93,serious,Recently someone minute fish worker.
94,marriage,Very various them.
95,star,Effect citizen again develop possible send worry.
96,dream,Reality add compare blood discussion big lot.
97,account,Always teach policy might free.
98,rate,Economic them team.
99,politics,Choice coach Congress effect improve public.
100,material,Will cover finish.
