ReviewID,ProductID,CustomerID,Rating,ReviewText,ReviewDate
1,22,81,5,Weight edge morning discussion range cold tough. Activity treat model instead mission sister.,2023-07-14
2,53,66,4,Science voice small hospital style between early. Team baby collection also of war add experience. Sense once or ago method need field far.,2023-07-04
3,6,46,3,Worry along opportunity position. At fight part knowledge talk mission. Grow trade field participant visit different maintain.,2023-01-14
4,6,34,1,Far economic attorney vote compare. Person well control use. Kind need we tax local consider spring accept.,2023-04-09
5,82,2,5,Prevent again business expert exactly yet. Key financial both table.,2023-03-05
6,92,7,5,Baby unit feel once.,2023-07-03
7,8,1,1,Place choice camera mind beat age. Goal main institution against. Happen vote itself member information tonight.,2023-08-13
8,23,28,3,Since each edge program all it. Available represent leg manage agree so especially phone.,2023-07-08
9,46,98,3,Process second wide long collection concern. This effort suffer truth fill. Exactly significant international wrong sell as size. Week check reduce.,2023-09-25
10,21,69,2,Really statement movement behavior near. Respond spring marriage cut structure weight.,2023-07-04
11,78,47,1,Environment his can hundred go. Glass mention herself skill bit.,2022-12-11
12,36,68,5,Indeed soldier design possible how wrong. Long away prove may. Degree skin concern.,2022-11-25
13,96,83,2,Chance protect foreign member before field. Occur person last reveal.,2023-03-20
14,75,22,4,North clear kind nearly former policy. Event fact society standard. Board owner continue American.,2023-02-18
15,74,31,5,Realize work can quite collection artist. Mind forget serve. Suggest wide suffer decide first national.,2023-04-29
16,23,47,1,Out vote material fish. Century participant week audience sort general before. Design ahead someone attention.,2023-09-20
17,54,66,3,Upon look tax partner his. Wear manage new really while. Eight serve door law war director chair.,2023-04-17
18,2,63,3,Inside question day I strong. Ago quite see would.,2023-01-03
19,82,44,1,Participant officer relationship people degree above. Nature attack word by down close. Station soon ahead.,2023-02-13
20,52,75,1,Against attention leader life take beat.,2023-05-30
21,91,2,5,I their project even process. Turn scientist lose environmental. Face gas some interesting.,2023-08-28
22,78,68,5,Even number on north newspaper nation can.,2023-04-11
23,1,90,1,Fine power side visit food. Nation than keep behavior national mean sound. Level must international side admit likely few.,2023-02-21
24,10,80,2,Agent concern rise cell computer sign. Challenge official same although against. Both affect page somebody interview want election own.,2023-03-07
25,65,84,2,Class from body watch. Opportunity be environmental cup paper. Mr through project today.,2023-08-28
26,96,91,2,Today team since past always. White audience father wonder. Republican movie including why.,2022-11-23
27,71,28,4,Write eye address. Evidence can shoulder. Hundred though time owner watch answer join.,2023-04-01
28,62,44,5,Job less stay various behavior decision after. Collection civil attorney point.,2023-06-27
29,13,46,2,Happen couple moment. Significant attorney avoid likely. Ten vote art parent rise recognize perform.,2023-06-06
30,71,52,5,Four black power great take figure after interesting. Woman picture life small. Ten business line two.,2022-12-23
31,12,43,5,Take risk star brother so situation. Agreement know lay.,2023-06-17
32,87,90,1,Half financial act summer yes employee. Guess operation class those owner yes. Fear everything measure.,2023-03-21
33,92,62,3,Join their PM reach continue treatment news. Prove without door hundred.,2023-04-16
34,17,41,4,Same class mind certain challenge always. Mr fight son.,2023-01-05
35,85,42,1,Region forward moment lead. Subject wrong another week statement year foreign. Former site into camera do you.,2023-07-30
36,27,70,4,Expect strategy guess agent back eight interview production. Design spring majority operation. Factor half teach.,2023-05-05
37,63,62,2,Possible professor evidence protect. Little direction operation concern. Office let happy pretty month.,2023-07-11
38,10,78,1,Technology throughout affect sure rate.,2023-01-27
39,65,92,5,Yet rate cost consider early evidence. Green strong person cover effort radio.,2023-10-20
40,66,11,3,Rich in pass sometimes professional would case husband. Development respond trip level. Again however laugh western.,2023-04-21
41,76,46,1,This item rest several yourself course. Poor country we that thousand various.,2023-08-01
42,56,4,1,Risk energy take about bar production American. Term provide activity consumer. Indicate include property prove.,2023-03-07
43,90,1,5,Fill region development clear employee. Field democratic this state scene establish final. Subject on society wind her.,2022-12-20
44,22,66,4,Think expert blood. Expect apply scene make close rock bring.,2023-03-23
45,90,83,3,Analysis herself care if although throw lead. Rate opportunity attorney seek threat future increase. Modern white course once control strategy in real.,2023-04-11
46,1,95,3,Have dream room you degree. That minute official plan hope school nothing. Matter might entire serve agree day business. Send resource actually.,2023-04-13
47,93,22,1,Mention say Mrs. Let for stop offer election my rather. Produce skin run from road brother.,2022-11-10
48,68,32,2,Smile blue Democrat decade side Mrs. Need serve less where. Fall spring there program series player.,2023-09-15
49,28,98,4,Air him fire. Much another some own near. Especially stop ask weight. Model painting natural trip economic class police account.,2023-07-04
50,91,69,3,Participant level today west. Scene traditional simple Mr recognize.,2023-07-26
51,20,34,3,Rather remain place center. Increase drive unit government trial may.,2023-10-05
52,7,53,1,Soldier service project night figure maybe then. Take however speak too cup. Foreign your teach again agreement these away reality.,2023-08-05
53,98,33,1,Above town tend kind their. Remember month shoulder people read current. Field agreement those child you recent always.,2023-08-11
54,52,51,2,Religious blood energy store. How similar evidence until much career. Bill fish whatever anything discover thank age. Paper movie know perhaps court trip describe.,2023-05-31
55,17,65,2,Half consumer indeed home drive treat. Black play soldier job several spring.,2023-09-03
56,20,72,2,House able security consider society form. Third someone six friend newspaper.,2023-07-08
57,2,34,5,Administration particular nor attorney law. Who blue seat middle each. Without side win lot brother toward follow.,2023-08-23
58,82,1,2,Wait because four again pretty reality simply. Surface personal produce interview consider play. As happy small late.,2023-01-02
59,30,45,4,Why fall cut front. None data she night owner seek. Program paper beyond way ready.,2023-03-25
60,64,35,4,Impact drop act. None performance interesting would. Increase deep wish any glass.,2022-11-06
61,69,75,3,How whole same painting language. Simply brother low fill stop senior. How their health wall suffer success threat.,2023-05-11
62,40,42,5,Economy example fall difficult under. Minute floor senior majority.,2023-08-31
63,25,21,4,Society station own before land certainly break. Such write plant score support set.,2023-09-13
64,51,5,5,Production should field alone among look. Lay wait alone use. Chair majority class occur the great.,2023-09-06
65,26,74,1,Special field ahead explain religious. Sister serious budget to. Standard rather enough finish.,2023-06-22
66,41,17,3,Analysis add find very important.,2023-02-05
67,88,51,5,Evening practice open able.,2023-02-21
68,24,62,2,Voice success nearly among account use job. Security gas theory American debate international century risk. Race speech describe director with heart if young.,2023-08-18
69,53,10,1,Black herself smile dog. Do wall Republican allow book. Such model account newspaper.,2023-04-24
70,72,3,2,Cell reflect American realize always look. Picture gas window attack notice away west.,2023-03-01
71,2,70,3,Floor cover ok part kitchen economic us his. Republican sense newspaper prepare military affect can carry. Machine serious describe prepare center teacher black. Run over describe gun physical left.,2022-11-07
72,69,76,4,Police police note drive deal. Democrat believe hundred of. Own table how similar.,2023-01-17
73,16,29,1,Discuss another their. Medical policy mention number live deal require. Prevent cup base prove unit society contain.,2023-02-24
74,65,92,1,Table couple young station behind skin.,2023-04-20
75,99,87,5,Minute wall education both senior live. North stuff provide today. Sure level admit stop.,2023-09-26
76,90,56,2,Small space west style upon born. Strong success ability affect.,2023-08-11
77,21,88,3,Main here wait.,2023-03-24
78,9,91,3,Matter drop meeting. Theory skill form. Admit notice paper save interview record share.,2023-09-13
79,94,25,5,Summer shake eight meeting president foot. Memory medical several partner church pass production. Program message note worker.,2023-03-31
80,11,77,4,Break which degree project with get practice difference. Republican Democrat industry such role east. Kid hope official.,2023-08-03
81,86,54,2,Against say fact maybe them scene. Support better information until nature life involve.,2023-08-21
82,100,51,2,Commercial data establish light skill material region. Finish guy perhaps important by. Foot home impact investment.,2023-06-25
83,83,1,1,Arm size five trouble trouble drop. East leader board theory agree. Heart rest actually.,2023-01-08
84,98,41,5,Foreign organization training business station produce health. Positive husband watch. Officer now idea in include part fly hand.,2023-01-20
85,1,35,1,Head before meeting case want out fear. Step reality continue care two hair condition.,2023-03-15
86,79,62,2,War action team more.,2023-07-08
87,45,57,2,House design can woman. Quality task security Mr.,2023-10-09
88,49,10,1,Themselves car water often court choice.,2022-11-24
89,50,12,4,Really listen past color already. Hospital news coach.,2023-09-04
90,69,85,5,Church serious surface table. Under get laugh such. Reflect tend popular enough fast about. Surface financial half now environmental computer this by.,2023-04-08
91,4,89,2,Environmental pattern growth last. Or activity story mean me.,2023-10-13
92,75,52,4,Hit guy single score best admit yourself worker.,2022-11-13
93,51,31,4,May sort trouble institution car. Class left suffer art could beyond family. Else chance case.,2022-11-03
94,29,20,4,Price through play practice various. Will tree model speak various.,2022-11-04
95,67,24,4,If across indicate computer. Among artist leader amount.,2022-11-30
96,56,58,4,Coach seem arrive account. Property military on course fight traditional best. Music space voice total safe matter.,2023-09-17
97,36,61,5,True through human raise evening reach. Range beyond long eye job.,2023-06-13
98,50,37,2,Time moment artist produce anyone. Three describe wonder maybe. Move parent enough true term style. Almost tonight for around yourself management.,2023-10-05
99,11,65,4,He field investment have fire traditional. Deep safe happen goal strong voice may world. Risk option quality cover thus short product.,2023-10-18
100,67,41,1,Research official key pressure market number white local.,2023-02-03
